"No."  ,"Time"           ,"Source"        ,"Destination"   ,"Protocol","Length","Info"
"1"    ,"02:24:03.084340","10.140.212.198","10.224.168.94" ,"TCP"     ,"822"   ,"52522  >  3478 [PSH, ACK] Seq=1 Ack=1 Win=65535 Len=768 [TCP segment of a reassembled PDU]"
"2"    ,"02:24:03.085819","10.224.168.94" ,"10.140.212.198","TCP"     ,"822"   ,"3478  >  52519 [PSH, ACK] Seq=1 Ack=1 Win=29200 Len=768 [TCP segment of a reassembled PDU]"
"3"    ,"02:24:03.085879","10.140.212.198","10.224.168.94" ,"TCP"     ,"54"    ,"52519  >  3478 [ACK] Seq=1 Ack=769 Win=65535 Len=0"
"4"    ,"02:24:03.121927","10.140.212.198","10.224.168.94" ,"TCP"     ,"974"   ,"52522  >  3478 [PSH, ACK] Seq=769 Ack=1 Win=65535 Len=920 [TCP segment of a reassembled PDU]"
"5"    ,"02:24:03.121985","10.140.212.198","10.224.168.94" ,"TCP"     ,"509"   ,"52522  >  3478 [PSH, ACK] Seq=1689 Ack=1 Win=65535 Len=455 [TCP segment of a reassembled PDU]"
"6"    ,"02:24:03.123357","10.224.168.94" ,"10.140.212.198","TCP"     ,"54"    ,"3478  >  52522 [ACK] Seq=1 Ack=1689 Win=65134 Len=0"
"7"    ,"02:24:03.123605","10.224.168.94" ,"10.140.212.198","TCP"     ,"974"   ,"3478  >  52519 [PSH, ACK] Seq=769 Ack=1 Win=29200 Len=920 [TCP segment of a reassembled PDU]"
"8"    ,"02:24:03.123668","10.140.212.198","10.224.168.94" ,"TCP"     ,"54"    ,"52519  >  3478 [ACK] Seq=1 Ack=1689 Win=65535 Len=0"
"9"    ,"02:24:03.124750","10.224.168.94" ,"10.140.212.198","TCP"     ,"509"   ,"3478  >  52519 [PSH, ACK] Seq=1689 Ack=1 Win=29200 Len=455 [TCP segment of a reassembled PDU]"
"10"   ,"02:24:03.124805","10.140.212.198","10.224.168.94" ,"TCP"     ,"54"    ,"52519  >  3478 [ACK] Seq=1 Ack=2144 Win=65535 Len=0"
"11"   ,"02:24:03.141576","10.140.212.198","10.224.168.94" ,"TCP"     ,"443"   ,"52522  >  3478 [PSH, ACK] Seq=2144 Ack=1 Win=65535 Len=389 [TCP segment of a reassembled PDU]"
"12"   ,"02:24:03.142775","10.224.168.94" ,"10.140.212.198","TCP"     ,"54"    ,"3478  >  52522 [ACK] Seq=1 Ack=2533 Win=65134 Len=0"
"13"   ,"02:24:03.143003","10.224.168.94" ,"10.140.212.198","TCP"     ,"443"   ,"3478  >  52519 [PSH, ACK] Seq=2144 Ack=1 Win=29200 Len=389 [TCP segment of a reassembled PDU]"
"14"   ,"02:24:03.143094","10.140.212.198","10.224.168.94" ,"TCP"     ,"54"    ,"52519  >  3478 [ACK] Seq=1 Ack=2533 Win=65535 Len=0"
"47"   ,"02:24:03.224195","10.140.212.198","10.224.168.94" ,"TCP"     ,"959"   ,"52522  >  3478 [PSH, ACK] Seq=2533 Ack=1 Win=65535 Len=905 [TCP segment of a reassembled PDU]"
"48"   ,"02:24:03.225752","10.224.168.94" ,"10.140.212.198","TCP"     ,"959"   ,"3478  >  52519 [PSH, ACK] Seq=2533 Ack=1 Win=29200 Len=905 [TCP segment of a reassembled PDU]"
"49"   ,"02:24:03.225830","10.140.212.198","10.224.168.94" ,"TCP"     ,"54"    ,"52519  >  3478 [ACK] Seq=1 Ack=3438 Win=65535 Len=0"
"50"   ,"02:24:03.242060","10.140.212.198","10.224.168.94" ,"TCP"     ,"274"   ,"52522  >  3478 [PSH, ACK] Seq=3438 Ack=1 Win=65535 Len=220 [TCP segment of a reassembled PDU]"
"51"   ,"02:24:03.243633","10.224.168.94" ,"10.140.212.198","TCP"     ,"54"    ,"3478  >  52522 [ACK] Seq=1 Ack=3658 Win=65134 Len=0"
"52"   ,"02:24:03.244779","10.224.168.94" ,"10.140.212.198","TCP"     ,"140"   ,"3478  >  52522 [PSH, ACK] Seq=1 Ack=3658 Win=65134 Len=86 [TCP segment of a reassembled PDU]"
"53"   ,"02:24:03.244782","10.224.168.94" ,"10.140.212.198","TCP"     ,"274"   ,"3478  >  52519 [PSH, ACK] Seq=3438 Ack=1 Win=29200 Len=220 [TCP segment of a reassembled PDU]"
"54"   ,"02:24:03.244866","10.140.212.198","10.224.168.94" ,"TCP"     ,"54"    ,"52522  >  3478 [ACK] Seq=3658 Ack=87 Win=65535 Len=0"
"55"   ,"02:24:03.244866","10.140.212.198","10.224.168.94" ,"TCP"     ,"54"    ,"52519  >  3478 [ACK] Seq=1 Ack=3658 Win=65535 Len=0"
"56"   ,"02:24:03.245165","10.140.212.198","10.224.168.94" ,"TCP"     ,"84"    ,"52519  >  3478 [PSH, ACK] Seq=1 Ack=3658 Win=65535 Len=30 [TCP segment of a reassembled PDU]"
"57"   ,"02:24:03.281805","10.140.212.198","10.224.168.94" ,"TCP"     ,"884"   ,"52522  >  3478 [PSH, ACK] Seq=3658 Ack=87 Win=65535 Len=830 [TCP segment of a reassembled PDU]"
"58"   ,"02:24:03.281875","10.140.212.198","10.224.168.94" ,"TCP"     ,"478"   ,"52522  >  3478 [PSH, ACK] Seq=4488 Ack=87 Win=65535 Len=424 [TCP segment of a reassembled PDU]"
"59"   ,"02:24:03.284393","10.224.168.94" ,"10.140.212.198","TCP"     ,"54"    ,"3478  >  52522 [ACK] Seq=87 Ack=4912 Win=65134 Len=0"
"60"   ,"02:24:03.284957","10.224.168.94" ,"10.140.212.198","TCP"     ,"884"   ,"3478  >  52519 [PSH, ACK] Seq=3658 Ack=31 Win=29200 Len=830 [TCP segment of a reassembled PDU]"
"61"   ,"02:24:03.285106","10.140.212.198","10.224.168.94" ,"TCP"     ,"54"    ,"52519  >  3478 [ACK] Seq=31 Ack=4488 Win=65535 Len=0"
"62"   ,"02:24:03.286740","10.224.168.94" ,"10.140.212.198","TCP"     ,"478"   ,"3478  >  52519 [PSH, ACK] Seq=4488 Ack=31 Win=29200 Len=424 [TCP segment of a reassembled PDU]"
"63"   ,"02:24:03.286909","10.140.212.198","10.224.168.94" ,"TCP"     ,"54"    ,"52519  >  3478 [ACK] Seq=31 Ack=4912 Win=65535 Len=0"
"79"   ,"02:24:03.321900","10.140.212.198","10.224.168.94" ,"TCP"     ,"255"   ,"52522  >  3478 [PSH, ACK] Seq=4912 Ack=87 Win=65535 Len=201 [TCP segment of a reassembled PDU]"
"80"   ,"02:24:03.323475","10.224.168.94" ,"10.140.212.198","TCP"     ,"255"   ,"3478  >  52519 [PSH, ACK] Seq=4912 Ack=31 Win=29200 Len=201 [TCP segment of a reassembled PDU]"
"81"   ,"02:24:03.323586","10.140.212.198","10.224.168.94" ,"TCP"     ,"54"    ,"52519  >  3478 [ACK] Seq=31 Ack=5113 Win=65535 Len=0"
"85"   ,"02:24:03.358835","10.140.212.198","10.224.168.94" ,"TCP"     ,"247"   ,"52522  >  3478 [PSH, ACK] Seq=5113 Ack=87 Win=65535 Len=193 [TCP segment of a reassembled PDU]"
"86"   ,"02:24:03.360068","10.224.168.94" ,"10.140.212.198","TCP"     ,"54"    ,"3478  >  52522 [ACK] Seq=87 Ack=5306 Win=65134 Len=0"
"87"   ,"02:24:03.360228","10.224.168.94" ,"10.140.212.198","TCP"     ,"247"   ,"3478  >  52519 [PSH, ACK] Seq=5113 Ack=31 Win=29200 Len=193 [TCP segment of a reassembled PDU]"
"88"   ,"02:24:03.360302","10.140.212.198","10.224.168.94" ,"TCP"     ,"54"    ,"52519  >  3478 [ACK] Seq=31 Ack=5306 Win=65535 Len=0"
"89"   ,"02:24:03.378214","10.140.212.198","10.224.168.94" ,"TCP"     ,"255"   ,"52522  >  3478 [PSH, ACK] Seq=5306 Ack=87 Win=65535 Len=201 [TCP segment of a reassembled PDU]"
"90"   ,"02:24:03.379576","10.224.168.94" ,"10.140.212.198","TCP"     ,"255"   ,"3478  >  52519 [PSH, ACK] Seq=5306 Ack=31 Win=29200 Len=201 [TCP segment of a reassembled PDU]"
"91"   ,"02:24:03.379682","10.140.212.198","10.224.168.94" ,"TCP"     ,"54"    ,"52519  >  3478 [ACK] Seq=31 Ack=5507 Win=65535 Len=0"
"123"  ,"02:24:03.418159","10.140.212.198","10.224.168.94" ,"TCP"     ,"247"   ,"52522  >  3478 [PSH, ACK] Seq=5507 Ack=87 Win=65535 Len=193 [TCP segment of a reassembled PDU]"
"124"  ,"02:24:03.419177","10.224.168.94" ,"10.140.212.198","TCP"     ,"54"    ,"3478  >  52522 [ACK] Seq=87 Ack=5507 Win=65134 Len=0"
"125"  ,"02:24:03.419181","10.224.168.94" ,"10.140.212.198","TCP"     ,"54"    ,"3478  >  52522 [ACK] Seq=87 Ack=5700 Win=65134 Len=0"
"126"  ,"02:24:03.419313","10.224.168.94" ,"10.140.212.198","TCP"     ,"247"   ,"3478  >  52519 [PSH, ACK] Seq=5507 Ack=31 Win=29200 Len=193 [TCP segment of a reassembled PDU]"
"127"  ,"02:24:03.419364","10.140.212.198","10.224.168.94" ,"TCP"     ,"54"    ,"52519  >  3478 [ACK] Seq=31 Ack=5700 Win=65535 Len=0"
"128"  ,"02:24:03.438277","10.140.212.198","10.224.168.94" ,"TCP"     ,"255"   ,"52522  >  3478 [PSH, ACK] Seq=5700 Ack=87 Win=65535 Len=201 [TCP segment of a reassembled PDU]"
"129"  ,"02:24:03.439606","10.224.168.94" ,"10.140.212.198","TCP"     ,"54"    ,"3478  >  52522 [ACK] Seq=87 Ack=5901 Win=65134 Len=0"
"130"  ,"02:24:03.439630","10.224.168.94" ,"10.140.212.198","TCP"     ,"255"   ,"3478  >  52519 [PSH, ACK] Seq=5700 Ack=31 Win=29200 Len=201 [TCP segment of a reassembled PDU]"
"131"  ,"02:24:03.439792","10.140.212.198","10.224.168.94" ,"TCP"     ,"54"    ,"52519  >  3478 [ACK] Seq=31 Ack=5901 Win=65535 Len=0"
"132"  ,"02:24:03.478867","10.140.212.198","10.224.168.94" ,"TCP"     ,"247"   ,"52522  >  3478 [PSH, ACK] Seq=5901 Ack=87 Win=65535 Len=193 [TCP segment of a reassembled PDU]"
"133"  ,"02:24:03.480541","10.224.168.94" ,"10.140.212.198","TCP"     ,"54"    ,"3478  >  52522 [ACK] Seq=87 Ack=6094 Win=65134 Len=0"
"134"  ,"02:24:03.480548","10.224.168.94" ,"10.140.212.198","TCP"     ,"247"   ,"3478  >  52519 [PSH, ACK] Seq=5901 Ack=31 Win=29200 Len=193 [TCP segment of a reassembled PDU]"
"135"  ,"02:24:03.480677","10.140.212.198","10.224.168.94" ,"TCP"     ,"54"    ,"52519  >  3478 [ACK] Seq=31 Ack=6094 Win=65535 Len=0"
"138"  ,"02:24:03.519229","10.140.212.198","10.224.168.94" ,"TCP"     ,"255"   ,"52522  >  3478 [PSH, ACK] Seq=6094 Ack=87 Win=65535 Len=201 [TCP segment of a reassembled PDU]"
"139"  ,"02:24:03.520671","10.224.168.94" ,"10.140.212.198","TCP"     ,"54"    ,"3478  >  52522 [ACK] Seq=87 Ack=6295 Win=65134 Len=0"
"140"  ,"02:24:03.520849","10.224.168.94" ,"10.140.212.198","TCP"     ,"140"   ,"3478  >  52522 [PSH, ACK] Seq=87 Ack=6295 Win=65134 Len=86 [TCP segment of a reassembled PDU]"
"141"  ,"02:24:03.520852","10.224.168.94" ,"10.140.212.198","TCP"     ,"255"   ,"3478  >  52519 [PSH, ACK] Seq=6094 Ack=31 Win=29200 Len=201 [TCP segment of a reassembled PDU]"
"142"  ,"02:24:03.520950","10.140.212.198","10.224.168.94" ,"TCP"     ,"54"    ,"52522  >  3478 [ACK] Seq=6295 Ack=173 Win=65535 Len=0"
"143"  ,"02:24:03.520950","10.140.212.198","10.224.168.94" ,"TCP"     ,"54"    ,"52519  >  3478 [ACK] Seq=31 Ack=6295 Win=65535 Len=0"
"144"  ,"02:24:03.521229","10.140.212.198","10.224.168.94" ,"TCP"     ,"84"    ,"52519  >  3478 [PSH, ACK] Seq=31 Ack=6295 Win=65535 Len=30 [TCP segment of a reassembled PDU]"
"145"  ,"02:24:03.538810","10.140.212.198","10.224.168.94" ,"TCP"     ,"247"   ,"52522  >  3478 [PSH, ACK] Seq=6295 Ack=173 Win=65535 Len=193 [TCP segment of a reassembled PDU]"
"146"  ,"02:24:03.540352","10.224.168.94" ,"10.140.212.198","TCP"     ,"247"   ,"3478  >  52519 [PSH, ACK] Seq=6295 Ack=61 Win=29200 Len=193 [TCP segment of a reassembled PDU]"
"147"  ,"02:24:03.540415","10.140.212.198","10.224.168.94" ,"TCP"     ,"54"    ,"52519  >  3478 [ACK] Seq=61 Ack=6488 Win=65535 Len=0"
"151"  ,"02:24:03.563092","10.140.212.198","10.224.168.94" ,"TCP"     ,"176"   ,"52519  >  3478 [PSH, ACK] Seq=61 Ack=6488 Win=65535 Len=122 [TCP segment of a reassembled PDU]"
"172"  ,"02:24:03.564363","10.224.168.94" ,"10.140.212.198","TCP"     ,"120"   ,"3478  >  52519 [PSH, ACK] Seq=6488 Ack=183 Win=29200 Len=66 [TCP segment of a reassembled PDU]"
"179"  ,"02:24:03.564457","10.140.212.198","10.224.168.94" ,"TCP"     ,"54"    ,"52519  >  3478 [ACK] Seq=183 Ack=6554 Win=65535 Len=0"
"180"  ,"02:24:03.579435","10.224.168.94" ,"10.140.212.198","TCP"     ,"54"    ,"3478  >  52522 [ACK] Seq=173 Ack=6488 Win=65134 Len=0"
"181"  ,"02:24:03.579455","10.140.212.198","10.224.168.94" ,"TCP"     ,"255"   ,"52522  >  3478 [PSH, ACK] Seq=6488 Ack=173 Win=65535 Len=201 [TCP segment of a reassembled PDU]"
"188"  ,"02:24:03.580943","10.224.168.94" ,"10.140.212.198","TCP"     ,"54"    ,"3478  >  52522 [ACK] Seq=173 Ack=6689 Win=65134 Len=0"
"195"  ,"02:24:03.581853","10.224.168.94" ,"10.140.212.198","TCP"     ,"255"   ,"3478  >  52519 [PSH, ACK] Seq=6554 Ack=183 Win=29200 Len=201 [TCP segment of a reassembled PDU]"
"202"  ,"02:24:03.581913","10.140.212.198","10.224.168.94" ,"TCP"     ,"54"    ,"52519  >  3478 [ACK] Seq=183 Ack=6755 Win=65535 Len=0"
"579"  ,"02:24:03.604088","10.140.212.198","10.224.168.94" ,"TCP"     ,"176"   ,"52522  >  3478 [PSH, ACK] Seq=6689 Ack=173 Win=65535 Len=122 [TCP segment of a reassembled PDU]"
"600"  ,"02:24:03.605899","10.224.168.94" ,"10.140.212.198","TCP"     ,"54"    ,"3478  >  52522 [ACK] Seq=173 Ack=6811 Win=65134 Len=0"
"606"  ,"02:24:03.606923","10.224.168.94" ,"10.140.212.198","TCP"     ,"120"   ,"3478  >  52522 [PSH, ACK] Seq=173 Ack=6811 Win=65134 Len=66 [TCP segment of a reassembled PDU]"
"615"  ,"02:24:03.607020","10.140.212.198","10.224.168.94" ,"TCP"     ,"54"    ,"52522  >  3478 [ACK] Seq=6811 Ack=239 Win=65535 Len=0"
"769"  ,"02:24:03.619399","10.140.212.198","10.224.168.94" ,"TCP"     ,"247"   ,"52522  >  3478 [PSH, ACK] Seq=6811 Ack=239 Win=65535 Len=193 [TCP segment of a reassembled PDU]"
"851"  ,"02:24:03.623534","10.224.168.94" ,"10.140.212.198","TCP"     ,"247"   ,"3478  >  52519 [PSH, ACK] Seq=6755 Ack=183 Win=29200 Len=193 [TCP segment of a reassembled PDU]"
"855"  ,"02:24:03.623697","10.140.212.198","10.224.168.94" ,"TCP"     ,"54"    ,"52519  >  3478 [ACK] Seq=183 Ack=6948 Win=65535 Len=0"
"856"  ,"02:24:03.630153","10.224.168.94" ,"10.140.212.198","TCP"     ,"136"   ,"3478  >  52522 [PSH, ACK] Seq=239 Ack=7004 Win=65134 Len=82 [TCP segment of a reassembled PDU]"
"857"  ,"02:24:03.630253","10.140.212.198","10.224.168.94" ,"TCP"     ,"54"    ,"52522  >  3478 [ACK] Seq=7004 Ack=321 Win=65535 Len=0"
"858"  ,"02:24:03.662264","10.140.212.198","10.224.168.94" ,"TCP"     ,"255"   ,"52522  >  3478 [PSH, ACK] Seq=7004 Ack=321 Win=65535 Len=201 [TCP segment of a reassembled PDU]"
"859"  ,"02:24:03.663890","10.224.168.94" ,"10.140.212.198","TCP"     ,"255"   ,"3478  >  52519 [PSH, ACK] Seq=6948 Ack=183 Win=29200 Len=201 [TCP segment of a reassembled PDU]"
"860"  ,"02:24:03.663930","10.140.212.198","10.224.168.94" ,"TCP"     ,"54"    ,"52519  >  3478 [ACK] Seq=183 Ack=7149 Win=65535 Len=0"
"861"  ,"02:24:03.679378","10.140.212.198","10.224.168.94" ,"TCP"     ,"247"   ,"52522  >  3478 [PSH, ACK] Seq=7205 Ack=321 Win=65535 Len=193 [TCP segment of a reassembled PDU]"
"862"  ,"02:24:03.680696","10.224.168.94" ,"10.140.212.198","TCP"     ,"54"    ,"3478  >  52522 [ACK] Seq=321 Ack=7398 Win=65134 Len=0"
"863"  ,"02:24:03.680699","10.224.168.94" ,"10.140.212.198","TCP"     ,"247"   ,"3478  >  52519 [PSH, ACK] Seq=7149 Ack=183 Win=29200 Len=193 [TCP segment of a reassembled PDU]"
"864"  ,"02:24:03.680757","10.140.212.198","10.224.168.94" ,"TCP"     ,"54"    ,"52519  >  3478 [ACK] Seq=183 Ack=7342 Win=65535 Len=0"
"867"  ,"02:24:03.720333","10.140.212.198","10.224.168.94" ,"TCP"     ,"255"   ,"52522  >  3478 [PSH, ACK] Seq=7398 Ack=321 Win=65535 Len=201 [TCP segment of a reassembled PDU]"
"868"  ,"02:24:03.721730","10.224.168.94" ,"10.140.212.198","TCP"     ,"255"   ,"3478  >  52519 [PSH, ACK] Seq=7342 Ack=183 Win=29200 Len=201 [TCP segment of a reassembled PDU]"
"869"  ,"02:24:03.721768","10.140.212.198","10.224.168.94" ,"TCP"     ,"54"    ,"52519  >  3478 [ACK] Seq=183 Ack=7543 Win=65535 Len=0"
"870"  ,"02:24:03.738098","10.140.212.198","10.224.168.94" ,"TCP"     ,"247"   ,"52522  >  3478 [PSH, ACK] Seq=7599 Ack=321 Win=65535 Len=193 [TCP segment of a reassembled PDU]"
"871"  ,"02:24:03.739578","10.224.168.94" ,"10.140.212.198","TCP"     ,"54"    ,"3478  >  52522 [ACK] Seq=321 Ack=7792 Win=65134 Len=0"
"872"  ,"02:24:03.740010","10.224.168.94" ,"10.140.212.198","TCP"     ,"247"   ,"3478  >  52519 [PSH, ACK] Seq=7543 Ack=183 Win=29200 Len=193 [TCP segment of a reassembled PDU]"
"873"  ,"02:24:03.740061","10.140.212.198","10.224.168.94" ,"TCP"     ,"54"    ,"52519  >  3478 [ACK] Seq=183 Ack=7736 Win=65535 Len=0"
"902"  ,"02:24:03.767123","10.140.212.198","10.224.168.94" ,"TCP"     ,"136"   ,"52522  >  3478 [PSH, ACK] Seq=7792 Ack=321 Win=65535 Len=82 [TCP segment of a reassembled PDU]"
"903"  ,"02:24:03.767125","10.140.212.198","10.224.168.94" ,"TCP"     ,"116"   ,"52519  >  3478 [PSH, ACK] Seq=183 Ack=7736 Win=65535 Len=62 [TCP segment of a reassembled PDU]"
"904"  ,"02:24:03.769050","10.224.168.94" ,"10.140.212.198","TCP"     ,"140"   ,"3478  >  52519 [PSH, ACK] Seq=7736 Ack=245 Win=29200 Len=86 [TCP segment of a reassembled PDU]"
"905"  ,"02:24:03.769145","10.140.212.198","10.224.168.94" ,"TCP"     ,"54"    ,"52519  >  3478 [ACK] Seq=245 Ack=7822 Win=65535 Len=0"
"906"  ,"02:24:03.770504","10.224.168.94" ,"10.140.212.198","TCP"     ,"164"   ,"3478  >  52519 [PSH, ACK] Seq=7822 Ack=245 Win=29200 Len=110 [TCP segment of a reassembled PDU]"
"907"  ,"02:24:03.770556","10.140.212.198","10.224.168.94" ,"TCP"     ,"54"    ,"52519  >  3478 [ACK] Seq=245 Ack=7932 Win=65535 Len=0"
"908"  ,"02:24:03.779534","10.140.212.198","10.224.168.94" ,"TCP"     ,"255"   ,"52522  >  3478 [PSH, ACK] Seq=7874 Ack=321 Win=65535 Len=201 [TCP segment of a reassembled PDU]"
"909"  ,"02:24:03.780818","10.224.168.94" ,"10.140.212.198","TCP"     ,"54"    ,"3478  >  52522 [ACK] Seq=321 Ack=8075 Win=65134 Len=0"
"910"  ,"02:24:03.780823","10.224.168.94" ,"10.140.212.198","TCP"     ,"140"   ,"3478  >  52522 [PSH, ACK] Seq=321 Ack=8075 Win=65134 Len=86 [TCP segment of a reassembled PDU]"
"911"  ,"02:24:03.780891","10.140.212.198","10.224.168.94" ,"TCP"     ,"54"    ,"52522  >  3478 [ACK] Seq=8075 Ack=407 Win=65535 Len=0"
"912"  ,"02:24:03.781228","10.224.168.94" ,"10.140.212.198","TCP"     ,"255"   ,"3478  >  52519 [PSH, ACK] Seq=7932 Ack=245 Win=29200 Len=201 [TCP segment of a reassembled PDU]"
"913"  ,"02:24:03.781276","10.140.212.198","10.224.168.94" ,"TCP"     ,"54"    ,"52519  >  3478 [ACK] Seq=245 Ack=8133 Win=65535 Len=0"
"914"  ,"02:24:03.781510","10.140.212.198","10.224.168.94" ,"TCP"     ,"84"    ,"52519  >  3478 [PSH, ACK] Seq=245 Ack=8133 Win=65535 Len=30 [TCP segment of a reassembled PDU]"
"915"  ,"02:24:03.820129","10.140.212.198","10.224.168.94" ,"TCP"     ,"247"   ,"52522  >  3478 [PSH, ACK] Seq=8075 Ack=407 Win=65535 Len=193 [TCP segment of a reassembled PDU]"
"916"  ,"02:24:03.821449","10.224.168.94" ,"10.140.212.198","TCP"     ,"247"   ,"3478  >  52519 [PSH, ACK] Seq=8133 Ack=275 Win=29200 Len=193 [TCP segment of a reassembled PDU]"
"917"  ,"02:24:03.821524","10.140.212.198","10.224.168.94" ,"TCP"     ,"54"    ,"52519  >  3478 [ACK] Seq=275 Ack=8326 Win=65535 Len=0"
"929"  ,"02:24:03.838220","10.140.212.198","10.224.168.94" ,"TCP"     ,"255"   ,"52522  >  3478 [PSH, ACK] Seq=8268 Ack=407 Win=65535 Len=201 [TCP segment of a reassembled PDU]"
"930"  ,"02:24:03.839494","10.224.168.94" ,"10.140.212.198","TCP"     ,"54"    ,"3478  >  52522 [ACK] Seq=407 Ack=8469 Win=65134 Len=0"
"931"  ,"02:24:03.839694","10.224.168.94" ,"10.140.212.198","TCP"     ,"255"   ,"3478  >  52519 [PSH, ACK] Seq=8326 Ack=275 Win=29200 Len=201 [TCP segment of a reassembled PDU]"
"932"  ,"02:24:03.839736","10.140.212.198","10.224.168.94" ,"TCP"     ,"54"    ,"52519  >  3478 [ACK] Seq=275 Ack=8527 Win=65535 Len=0"
"964"  ,"02:24:03.978188","10.140.212.198","10.224.168.94" ,"TCP"     ,"1140"  ,"52522  >  3478 [PSH, ACK] Seq=8469 Ack=407 Win=65535 Len=1086 [TCP segment of a reassembled PDU]"
"965"  ,"02:24:03.978256","10.140.212.198","10.224.168.94" ,"TCP"     ,"1140"  ,"52522  >  3478 [PSH, ACK] Seq=9555 Ack=407 Win=65535 Len=1086 [TCP segment of a reassembled PDU]"
"966"  ,"02:24:03.978295","10.140.212.198","10.224.168.94" ,"TCP"     ,"1140"  ,"52522  >  3478 [PSH, ACK] Seq=10641 Ack=407 Win=65535 Len=1086 [TCP segment of a reassembled PDU]"
"967"  ,"02:24:03.978315","10.140.212.198","10.224.168.94" ,"TCP"     ,"1140"  ,"52522  >  3478 [PSH, ACK] Seq=11727 Ack=407 Win=65535 Len=1086 [TCP segment of a reassembled PDU]"
"968"  ,"02:24:03.978337","10.140.212.198","10.224.168.94" ,"TCP"     ,"1140"  ,"52522  >  3478 [PSH, ACK] Seq=12813 Ack=407 Win=65535 Len=1086 [TCP segment of a reassembled PDU]"
"969"  ,"02:24:03.978406","10.140.212.198","10.224.168.94" ,"TCP"     ,"1140"  ,"52522  >  3478 [PSH, ACK] Seq=13899 Ack=407 Win=65535 Len=1086 [TCP segment of a reassembled PDU]"
"970"  ,"02:24:03.978426","10.140.212.198","10.224.168.94" ,"TCP"     ,"1140"  ,"52522  >  3478 [PSH, ACK] Seq=14985 Ack=407 Win=65535 Len=1086 [TCP segment of a reassembled PDU]"
"971"  ,"02:24:03.979912","10.224.168.94" ,"10.140.212.198","TCP"     ,"54"    ,"3478  >  52522 [ACK] Seq=407 Ack=10641 Win=65134 Len=0"
"972"  ,"02:24:03.980200","10.224.168.94" ,"10.140.212.198","TCP"     ,"54"    ,"3478  >  52522 [ACK] Seq=407 Ack=12813 Win=65134 Len=0"
"973"  ,"02:24:03.980202","10.224.168.94" ,"10.140.212.198","TCP"     ,"54"    ,"3478  >  52522 [ACK] Seq=407 Ack=14985 Win=65134 Len=0"
"974"  ,"02:24:03.980544","10.224.168.94" ,"10.140.212.198","TCP"     ,"1140"  ,"3478  >  52519 [PSH, ACK] Seq=8527 Ack=275 Win=29200 Len=1086 [TCP segment of a reassembled PDU]"
"975"  ,"02:24:03.980592","10.140.212.198","10.224.168.94" ,"TCP"     ,"54"    ,"52519  >  3478 [ACK] Seq=275 Ack=9613 Win=65535 Len=0"
"976"  ,"02:24:03.981214","10.224.168.94" ,"10.140.212.198","TCP"     ,"1514"  ,"3478  >  52519 [ACK] Seq=9613 Ack=275 Win=29200 Len=1460 [TCP segment of a reassembled PDU]"
"977"  ,"02:24:03.981218","10.224.168.94" ,"10.140.212.198","TCP"     ,"1514"  ,"3478  >  52519 [ACK] Seq=11073 Ack=275 Win=29200 Len=1460 [TCP segment of a reassembled PDU]"
"978"  ,"02:24:03.981269","10.140.212.198","10.224.168.94" ,"TCP"     ,"54"    ,"52519  >  3478 [ACK] Seq=275 Ack=12533 Win=65535 Len=0"
"979"  ,"02:24:03.981405","10.224.168.94" ,"10.140.212.198","TCP"     ,"1514"  ,"3478  >  52519 [ACK] Seq=12533 Ack=275 Win=29200 Len=1460 [TCP segment of a reassembled PDU]"
"980"  ,"02:24:03.981409","10.224.168.94" ,"10.140.212.198","TCP"     ,"1514"  ,"3478  >  52519 [ACK] Seq=13993 Ack=275 Win=29200 Len=1460 [TCP segment of a reassembled PDU]"
"981"  ,"02:24:03.981449","10.140.212.198","10.224.168.94" ,"TCP"     ,"54"    ,"52519  >  3478 [ACK] Seq=275 Ack=15453 Win=65535 Len=0"
"982"  ,"02:24:03.982040","10.224.168.94" ,"10.140.212.198","TCP"     ,"730"   ,"3478  >  52519 [PSH, ACK] Seq=15453 Ack=275 Win=29200 Len=676 [TCP segment of a reassembled PDU]"
"983"  ,"02:24:03.982077","10.140.212.198","10.224.168.94" ,"TCP"     ,"54"    ,"52519  >  3478 [ACK] Seq=275 Ack=16129 Win=65535 Len=0"
"984"  ,"02:24:04.001800","10.140.212.198","10.224.168.94" ,"TCP"     ,"1140"  ,"52522  >  3478 [PSH, ACK] Seq=16071 Ack=407 Win=65535 Len=1086 [TCP segment of a reassembled PDU]"
"985"  ,"02:24:04.001866","10.140.212.198","10.224.168.94" ,"TCP"     ,"1140"  ,"52522  >  3478 [PSH, ACK] Seq=17157 Ack=407 Win=65535 Len=1086 [TCP segment of a reassembled PDU]"
"986"  ,"02:24:04.001877","10.140.212.198","10.224.168.94" ,"TCP"     ,"1140"  ,"52522  >  3478 [PSH, ACK] Seq=18243 Ack=407 Win=65535 Len=1086 [TCP segment of a reassembled PDU]"
"987"  ,"02:24:04.001903","10.140.212.198","10.224.168.94" ,"TCP"     ,"1140"  ,"52522  >  3478 [PSH, ACK] Seq=19329 Ack=407 Win=65535 Len=1086 [TCP segment of a reassembled PDU]"
"988"  ,"02:24:04.001923","10.140.212.198","10.224.168.94" ,"TCP"     ,"1140"  ,"52522  >  3478 [PSH, ACK] Seq=20415 Ack=407 Win=65535 Len=1086 [TCP segment of a reassembled PDU]"
"989"  ,"02:24:04.002014","10.140.212.198","10.224.168.94" ,"TCP"     ,"1132"  ,"52522  >  3478 [PSH, ACK] Seq=21501 Ack=407 Win=65535 Len=1078 [TCP segment of a reassembled PDU]"
"990"  ,"02:24:04.002072","10.140.212.198","10.224.168.94" ,"TCP"     ,"1122"  ,"52522  >  3478 [PSH, ACK] Seq=22579 Ack=407 Win=65535 Len=1068 [TCP segment of a reassembled PDU]"
"991"  ,"02:24:04.003215","10.224.168.94" ,"10.140.212.198","TCP"     ,"54"    ,"3478  >  52522 [ACK] Seq=407 Ack=17157 Win=65134 Len=0"
"992"  ,"02:24:04.003224","10.224.168.94" ,"10.140.212.198","TCP"     ,"1140"  ,"3478  >  52519 [PSH, ACK] Seq=16129 Ack=275 Win=29200 Len=1086 [TCP segment of a reassembled PDU]"
"993"  ,"02:24:04.003406","10.140.212.198","10.224.168.94" ,"TCP"     ,"54"    ,"52519  >  3478 [ACK] Seq=275 Ack=17215 Win=65535 Len=0"
"994"  ,"02:24:04.003602","10.224.168.94" ,"10.140.212.198","TCP"     ,"54"    ,"3478  >  52522 [ACK] Seq=407 Ack=19329 Win=65134 Len=0"
"995"  ,"02:24:04.003606","10.224.168.94" ,"10.140.212.198","TCP"     ,"54"    ,"3478  >  52522 [ACK] Seq=407 Ack=21501 Win=65134 Len=0"
"996"  ,"02:24:04.003607","10.224.168.94" ,"10.140.212.198","TCP"     ,"54"    ,"3478  >  52522 [ACK] Seq=407 Ack=23647 Win=65134 Len=0"
"997"  ,"02:24:04.004233","10.224.168.94" ,"10.140.212.198","TCP"     ,"1514"  ,"3478  >  52519 [ACK] Seq=17215 Ack=275 Win=29200 Len=1460 [TCP segment of a reassembled PDU]"
"998"  ,"02:24:04.004240","10.224.168.94" ,"10.140.212.198","TCP"     ,"1514"  ,"3478  >  52519 [ACK] Seq=18675 Ack=275 Win=29200 Len=1460 [TCP segment of a reassembled PDU]"
"999"  ,"02:24:04.004242","10.224.168.94" ,"10.140.212.198","TCP"     ,"1514"  ,"3478  >  52519 [ACK] Seq=20135 Ack=275 Win=29200 Len=1460 [TCP segment of a reassembled PDU]"
"1000" ,"02:24:04.004344","10.224.168.94" ,"10.140.212.198","TCP"     ,"1514"  ,"3478  >  52519 [ACK] Seq=21595 Ack=275 Win=29200 Len=1460 [TCP segment of a reassembled PDU]"
"1001" ,"02:24:04.004368","10.140.212.198","10.224.168.94" ,"TCP"     ,"54"    ,"52519  >  3478 [ACK] Seq=275 Ack=20135 Win=65535 Len=0"
"1002" ,"02:24:04.004608","10.224.168.94" ,"10.140.212.198","TCP"     ,"704"   ,"3478  >  52519 [PSH, ACK] Seq=23055 Ack=275 Win=29200 Len=650 [TCP segment of a reassembled PDU]"
"1003" ,"02:24:04.004653","10.140.212.198","10.224.168.94" ,"TCP"     ,"54"    ,"52519  >  3478 [ACK] Seq=275 Ack=23705 Win=65535 Len=0"
"1004" ,"02:24:04.021372","10.140.212.198","10.224.168.94" ,"TCP"     ,"1122"  ,"52522  >  3478 [PSH, ACK] Seq=23647 Ack=407 Win=65535 Len=1068 [TCP segment of a reassembled PDU]"
"1005" ,"02:24:04.021430","10.140.212.198","10.224.168.94" ,"TCP"     ,"1122"  ,"52522  >  3478 [PSH, ACK] Seq=24715 Ack=407 Win=65535 Len=1068 [TCP segment of a reassembled PDU]"
"1006" ,"02:24:04.021453","10.140.212.198","10.224.168.94" ,"TCP"     ,"1122"  ,"52522  >  3478 [PSH, ACK] Seq=25783 Ack=407 Win=65535 Len=1068 [TCP segment of a reassembled PDU]"
"1007" ,"02:24:04.021483","10.140.212.198","10.224.168.94" ,"TCP"     ,"1122"  ,"52522  >  3478 [PSH, ACK] Seq=26851 Ack=407 Win=65535 Len=1068 [TCP segment of a reassembled PDU]"
"1008" ,"02:24:04.021517","10.140.212.198","10.224.168.94" ,"TCP"     ,"1122"  ,"52522  >  3478 [PSH, ACK] Seq=27919 Ack=407 Win=65535 Len=1068 [TCP segment of a reassembled PDU]"
"1009" ,"02:24:04.021552","10.140.212.198","10.224.168.94" ,"TCP"     ,"1122"  ,"52522  >  3478 [PSH, ACK] Seq=28987 Ack=407 Win=65535 Len=1068 [TCP segment of a reassembled PDU]"
"1010" ,"02:24:04.021553","10.140.212.198","10.224.168.94" ,"TCP"     ,"1122"  ,"52522  >  3478 [PSH, ACK] Seq=30055 Ack=407 Win=65535 Len=1068 [TCP segment of a reassembled PDU]"
"1011" ,"02:24:04.023080","10.224.168.94" ,"10.140.212.198","TCP"     ,"54"    ,"3478  >  52522 [ACK] Seq=407 Ack=25783 Win=65134 Len=0"
"1012" ,"02:24:04.023295","10.224.168.94" ,"10.140.212.198","TCP"     ,"1122"  ,"3478  >  52519 [PSH, ACK] Seq=23705 Ack=275 Win=29200 Len=1068 [TCP segment of a reassembled PDU]"
"1013" ,"02:24:04.023422","10.140.212.198","10.224.168.94" ,"TCP"     ,"54"    ,"52519  >  3478 [ACK] Seq=275 Ack=24773 Win=65535 Len=0"
"1014" ,"02:24:04.023487","10.224.168.94" ,"10.140.212.198","TCP"     ,"54"    ,"3478  >  52522 [ACK] Seq=407 Ack=27919 Win=65134 Len=0"
"1015" ,"02:24:04.023728","10.224.168.94" ,"10.140.212.198","TCP"     ,"54"    ,"3478  >  52522 [ACK] Seq=407 Ack=30055 Win=65134 Len=0"
"1016" ,"02:24:04.024012","10.224.168.94" ,"10.140.212.198","TCP"     ,"1514"  ,"3478  >  52519 [ACK] Seq=24773 Ack=275 Win=29200 Len=1460 [TCP segment of a reassembled PDU]"
"1017" ,"02:24:04.024401","10.224.168.94" ,"10.140.212.198","TCP"     ,"1514"  ,"3478  >  52519 [ACK] Seq=26233 Ack=275 Win=29200 Len=1460 [TCP segment of a reassembled PDU]"
"1018" ,"02:24:04.024404","10.224.168.94" ,"10.140.212.198","TCP"     ,"1514"  ,"3478  >  52519 [ACK] Seq=27693 Ack=275 Win=29200 Len=1460 [TCP segment of a reassembled PDU]"
"1019" ,"02:24:04.024569","10.224.168.94" ,"10.140.212.198","TCP"     ,"1514"  ,"3478  >  52519 [ACK] Seq=29153 Ack=275 Win=29200 Len=1460 [TCP segment of a reassembled PDU]"
"1020" ,"02:24:04.025003","10.224.168.94" ,"10.140.212.198","TCP"     ,"622"   ,"3478  >  52519 [PSH, ACK] Seq=30613 Ack=275 Win=29200 Len=568 [TCP segment of a reassembled PDU]"
"1021" ,"02:24:04.025080","10.140.212.198","10.224.168.94" ,"TCP"     ,"54"    ,"52519  >  3478 [ACK] Seq=275 Ack=31181 Win=65535 Len=0"
"1022" ,"02:24:04.038612","10.140.212.198","10.224.168.94" ,"TCP"     ,"1122"  ,"52522  >  3478 [PSH, ACK] Seq=31123 Ack=407 Win=65535 Len=1068 [TCP segment of a reassembled PDU]"
"1023" ,"02:24:04.038685","10.140.212.198","10.224.168.94" ,"TCP"     ,"1121"  ,"52522  >  3478 [PSH, ACK] Seq=32191 Ack=407 Win=65535 Len=1067 [TCP segment of a reassembled PDU]"
"1024" ,"02:24:04.038685","10.140.212.198","10.224.168.94" ,"TCP"     ,"1087"  ,"52522  >  3478 [PSH, ACK] Seq=33258 Ack=407 Win=65535 Len=1033 [TCP segment of a reassembled PDU]"
"1025" ,"02:24:04.038686","10.140.212.198","10.224.168.94" ,"TCP"     ,"1087"  ,"52522  >  3478 [PSH, ACK] Seq=34291 Ack=407 Win=65535 Len=1033 [TCP segment of a reassembled PDU]"
"1026" ,"02:24:04.038702","10.140.212.198","10.224.168.94" ,"TCP"     ,"1087"  ,"52522  >  3478 [PSH, ACK] Seq=35324 Ack=407 Win=65535 Len=1033 [TCP segment of a reassembled PDU]"
"1027" ,"02:24:04.038794","10.140.212.198","10.224.168.94" ,"TCP"     ,"1087"  ,"52522  >  3478 [PSH, ACK] Seq=36357 Ack=407 Win=65535 Len=1033 [TCP segment of a reassembled PDU]"
"1028" ,"02:24:04.038814","10.140.212.198","10.224.168.94" ,"TCP"     ,"1087"  ,"52522  >  3478 [PSH, ACK] Seq=37390 Ack=407 Win=65535 Len=1033 [TCP segment of a reassembled PDU]"
"1029" ,"02:24:04.040204","10.224.168.94" ,"10.140.212.198","TCP"     ,"54"    ,"3478  >  52522 [ACK] Seq=407 Ack=32191 Win=65134 Len=0"
"1030" ,"02:24:04.040461","10.224.168.94" ,"10.140.212.198","TCP"     ,"54"    ,"3478  >  52522 [ACK] Seq=407 Ack=34291 Win=65134 Len=0"
"1031" ,"02:24:04.040465","10.224.168.94" ,"10.140.212.198","TCP"     ,"54"    ,"3478  >  52522 [ACK] Seq=407 Ack=36357 Win=65134 Len=0"
"1032" ,"02:24:04.040510","10.224.168.94" ,"10.140.212.198","TCP"     ,"54"    ,"3478  >  52522 [ACK] Seq=407 Ack=38423 Win=65134 Len=0"
"1033" ,"02:24:04.040853","10.224.168.94" ,"10.140.212.198","TCP"     ,"140"   ,"3478  >  52522 [PSH, ACK] Seq=407 Ack=38423 Win=65134 Len=86 [TCP segment of a reassembled PDU]"
"1034" ,"02:24:04.040855","10.224.168.94" ,"10.140.212.198","TCP"     ,"1122"  ,"3478  >  52519 [PSH, ACK] Seq=31181 Ack=275 Win=29200 Len=1068 [TCP segment of a reassembled PDU]"
"1035" ,"02:24:04.040957","10.140.212.198","10.224.168.94" ,"TCP"     ,"54"    ,"52522  >  3478 [ACK] Seq=38423 Ack=493 Win=65535 Len=0"
"1036" ,"02:24:04.041004","10.140.212.198","10.224.168.94" ,"TCP"     ,"54"    ,"52519  >  3478 [ACK] Seq=275 Ack=32249 Win=65535 Len=0"
"1037" ,"02:24:04.041221","10.140.212.198","10.224.168.94" ,"TCP"     ,"84"    ,"52519  >  3478 [PSH, ACK] Seq=275 Ack=32249 Win=65535 Len=30 [TCP segment of a reassembled PDU]"
"1038" ,"02:24:04.041360","10.224.168.94" ,"10.140.212.198","TCP"     ,"1514"  ,"3478  >  52519 [ACK] Seq=32249 Ack=275 Win=29200 Len=1460 [TCP segment of a reassembled PDU]"
"1039" ,"02:24:04.041365","10.224.168.94" ,"10.140.212.198","TCP"     ,"1514"  ,"3478  >  52519 [ACK] Seq=33709 Ack=275 Win=29200 Len=1460 [TCP segment of a reassembled PDU]"
"1040" ,"02:24:04.041798","10.224.168.94" ,"10.140.212.198","TCP"     ,"1514"  ,"3478  >  52519 [ACK] Seq=35169 Ack=275 Win=29200 Len=1460 [TCP segment of a reassembled PDU]"
"1041" ,"02:24:04.041802","10.224.168.94" ,"10.140.212.198","TCP"     ,"1514"  ,"3478  >  52519 [ACK] Seq=36629 Ack=275 Win=29200 Len=1460PT=ITU-T G.728, SSRC=0x6A123DBC, Seq=31356, Time=288246880"
"1042" ,"02:24:04.042476","10.224.168.94" ,"10.140.212.198","TCP"     ,"446"   ,"3478  >  52519 [PSH, ACK] Seq=38089 Ack=275 Win=29200 Len=392 [TCP segment of a reassembled PDU]"
"1043" ,"02:24:04.042541","10.140.212.198","10.224.168.94" ,"TCP"     ,"54"    ,"52519  >  3478 [ACK] Seq=305 Ack=38481 Win=65535 Len=0"
"1044" ,"02:24:04.058739","10.140.212.198","10.224.168.94" ,"TCP"     ,"1087"  ,"52522  >  3478 [PSH, ACK] Seq=38423 Ack=493 Win=65535 Len=1033 [TCP segment of a reassembled PDU]"
"1045" ,"02:24:04.058740","10.140.212.198","10.224.168.94" ,"TCP"     ,"1087"  ,"52522  >  3478 [PSH, ACK] Seq=39456 Ack=493 Win=65535 Len=1033 [TCP segment of a reassembled PDU]"
"1046" ,"02:24:04.058811","10.140.212.198","10.224.168.94" ,"TCP"     ,"1081"  ,"52522  >  3478 [PSH, ACK] Seq=40489 Ack=493 Win=65535 Len=1027 [TCP segment of a reassembled PDU]"
"1047" ,"02:24:04.058811","10.140.212.198","10.224.168.94" ,"TCP"     ,"1165"  ,"52522  >  3478 [PSH, ACK] Seq=41516 Ack=493 Win=65535 Len=1111 [TCP segment of a reassembled PDU]"
"1048" ,"02:24:04.058928","10.140.212.198","10.224.168.94" ,"TCP"     ,"1165"  ,"52522  >  3478 [PSH, ACK] Seq=42627 Ack=493 Win=65535 Len=1111 [TCP segment of a reassembled PDU]"
"1049" ,"02:24:04.058928","10.140.212.198","10.224.168.94" ,"TCP"     ,"1165"  ,"52522  >  3478 [PSH, ACK] Seq=43738 Ack=493 Win=65535 Len=1111 [TCP segment of a reassembled PDU]"
"1050" ,"02:24:04.058929","10.140.212.198","10.224.168.94" ,"TCP"     ,"1165"  ,"52522  >  3478 [PSH, ACK] Seq=44849 Ack=493 Win=65535 Len=1111 [TCP segment of a reassembled PDU]"
"1051" ,"02:24:04.060318","10.224.168.94" ,"10.140.212.198","TCP"     ,"54"    ,"3478  >  52522 [ACK] Seq=493 Ack=40489 Win=65134 Len=0"
"1052" ,"02:24:04.060504","10.224.168.94" ,"10.140.212.198","TCP"     ,"1087"  ,"3478  >  52519 [PSH, ACK] Seq=38481 Ack=305 Win=29200 Len=1033 [TCP segment of a reassembled PDU]"
"1053" ,"02:24:04.060646","10.140.212.198","10.224.168.94" ,"TCP"     ,"54"    ,"52519  >  3478 [ACK] Seq=305 Ack=39514 Win=65535 Len=0"
"1054" ,"02:24:04.060897","10.224.168.94" ,"10.140.212.198","TCP"     ,"54"    ,"3478  >  52522 [ACK] Seq=493 Ack=42627 Win=65134 Len=0"
"1055" ,"02:24:04.061302","10.224.168.94" ,"10.140.212.198","TCP"     ,"54"    ,"3478  >  52522 [ACK] Seq=493 Ack=44849 Win=65134 Len=0"
"1056" ,"02:24:04.061305","10.224.168.94" ,"10.140.212.198","TCP"     ,"1514"  ,"3478  >  52519 [ACK] Seq=39514 Ack=305 Win=29200 Len=1460 [TCP segment of a reassembled PDU]"
"1057" ,"02:24:04.061548","10.224.168.94" ,"10.140.212.198","TCP"     ,"1514"  ,"3478  >  52519 [ACK] Seq=40974 Ack=305 Win=29200 Len=1460 [TCP segment of a reassembled PDU]"
"1058" ,"02:24:04.061742","10.224.168.94" ,"10.140.212.198","TCP"     ,"1514"  ,"3478  >  52519 [ACK] Seq=42434 Ack=305 Win=29200 Len=1460 [TCP segment of a reassembled PDU]"
"1059" ,"02:24:04.061745","10.224.168.94" ,"10.140.212.198","TCP"     ,"1514"  ,"3478  >  52519 [ACK] Seq=43894 Ack=305 Win=29200 Len=1460 [TCP segment of a reassembled PDU]"
"1060" ,"02:24:04.061968","10.224.168.94" ,"10.140.212.198","TCP"     ,"718"   ,"3478  >  52519 [PSH, ACK] Seq=45354 Ack=305 Win=29200 Len=664 [TCP segment of a reassembled PDU]"
"1061" ,"02:24:04.062020","10.140.212.198","10.224.168.94" ,"TCP"     ,"54"    ,"52519  >  3478 [ACK] Seq=305 Ack=46018 Win=65535 Len=0"
"1062" ,"02:24:04.078772","10.140.212.198","10.224.168.94" ,"TCP"     ,"1165"  ,"52522  >  3478 [PSH, ACK] Seq=45960 Ack=493 Win=65535 Len=1111 [TCP segment of a reassembled PDU]"
"1063" ,"02:24:04.078841","10.140.212.198","10.224.168.94" ,"TCP"     ,"1165"  ,"52522  >  3478 [PSH, ACK] Seq=47071 Ack=493 Win=65535 Len=1111 [TCP segment of a reassembled PDU]"
"1064" ,"02:24:04.078872","10.140.212.198","10.224.168.94" ,"TCP"     ,"1165"  ,"52522  >  3478 [PSH, ACK] Seq=48182 Ack=493 Win=65535 Len=1111 [TCP segment of a reassembled PDU]"
"1065" ,"02:24:04.078906","10.140.212.198","10.224.168.94" ,"TCP"     ,"1165"  ,"52522  >  3478 [PSH, ACK] Seq=49293 Ack=493 Win=65535 Len=1111 [TCP segment of a reassembled PDU]"
"1066" ,"02:24:04.078958","10.140.212.198","10.224.168.94" ,"TCP"     ,"1163"  ,"52522  >  3478 [PSH, ACK] Seq=50404 Ack=493 Win=65535 Len=1109 [TCP segment of a reassembled PDU]"
"1067" ,"02:24:04.078986","10.140.212.198","10.224.168.94" ,"TCP"     ,"545"   ,"52522  >  3478 [PSH, ACK] Seq=51513 Ack=493 Win=65535 Len=491 [TCP segment of a reassembled PDU]"
"1068" ,"02:24:04.079019","10.140.212.198","10.224.168.94" ,"TCP"     ,"1089"  ,"52522  >  3478 [PSH, ACK] Seq=52004 Ack=493 Win=65535 Len=1035 [TCP segment of a reassembled PDU]"
"1069" ,"02:24:04.079076","10.140.212.198","10.224.168.94" ,"TCP"     ,"909"   ,"52522  >  3478 [PSH, ACK] Seq=53039 Ack=493 Win=65535 Len=855 [TCP segment of a reassembled PDU]"
"1070" ,"02:24:04.080213","10.224.168.94" ,"10.140.212.198","TCP"     ,"54"    ,"3478  >  52522 [ACK] Seq=493 Ack=47071 Win=65134 Len=0"
"1071" ,"02:24:04.080510","10.224.168.94" ,"10.140.212.198","TCP"     ,"54"    ,"3478  >  52522 [ACK] Seq=493 Ack=49293 Win=65134 Len=0"
"1072" ,"02:24:04.080514","10.224.168.94" ,"10.140.212.198","TCP"     ,"54"    ,"3478  >  52522 [ACK] Seq=493 Ack=51513 Win=65134 Len=0"
"1073" ,"02:24:04.080515","10.224.168.94" ,"10.140.212.198","TCP"     ,"54"    ,"3478  >  52522 [ACK] Seq=493 Ack=53039 Win=65134 Len=0"
"1074" ,"02:24:04.080837","10.224.168.94" ,"10.140.212.198","TCP"     ,"1165"  ,"3478  >  52519 [PSH, ACK] Seq=46018 Ack=305 Win=29200 Len=1111 [TCP segment of a reassembled PDU]"
"1075" ,"02:24:04.080880","10.140.212.198","10.224.168.94" ,"TCP"     ,"54"    ,"52519  >  3478 [ACK] Seq=305 Ack=47129 Win=65535 Len=0"
"1076" ,"02:24:04.081490","10.224.168.94" ,"10.140.212.198","TCP"     ,"1514"  ,"3478  >  52519 [ACK] Seq=47129 Ack=305 Win=29200 Len=1460 [TCP segment of a reassembled PDU]"
"1077" ,"02:24:04.081493","10.224.168.94" ,"10.140.212.198","TCP"     ,"1514"  ,"3478  >  52519 [ACK] Seq=48589 Ack=305 Win=29200 Len=1460 [TCP segment of a reassembled PDU]"
"1078" ,"02:24:04.081717","10.224.168.94" ,"10.140.212.198","TCP"     ,"1514"  ,"3478  >  52519 [ACK] Seq=50049 Ack=305 Win=29200 Len=1460 [TCP segment of a reassembled PDU]"
"1079" ,"02:24:04.081720","10.224.168.94" ,"10.140.212.198","TCP"     ,"1514"  ,"3478  >  52519 [ACK] Seq=51509 Ack=305 Win=29200 Len=1460 [TCP segment of a reassembled PDU]"
"1080" ,"02:24:04.081989","10.224.168.94" ,"10.140.212.198","TCP"     ,"1037"  ,"3478  >  52519 [PSH, ACK] Seq=52969 Ack=305 Win=29200 Len=983 [TCP segment of a reassembled PDU]"
"1081" ,"02:24:04.082028","10.140.212.198","10.224.168.94" ,"TCP"     ,"54"    ,"52519  >  3478 [ACK] Seq=305 Ack=53952 Win=65535 Len=0"
"1082" ,"02:24:04.103329","10.140.212.198","10.224.168.94" ,"TCP"     ,"819"   ,"52522  >  3478 [PSH, ACK] Seq=53894 Ack=493 Win=65535 Len=765 [TCP segment of a reassembled PDU]"
"1083" ,"02:24:04.103422","10.140.212.198","10.224.168.94" ,"TCP"     ,"755"   ,"52522  >  3478 [PSH, ACK] Seq=54659 Ack=493 Win=65535 Len=701 [TCP segment of a reassembled PDU]"
"1084" ,"02:24:04.103422","10.140.212.198","10.224.168.94" ,"TCP"     ,"754"   ,"52522  >  3478 [PSH, ACK] Seq=55360 Ack=493 Win=65535 Len=700 [TCP segment of a reassembled PDU]"
"1085" ,"02:24:04.103423","10.140.212.198","10.224.168.94" ,"TCP"     ,"1090"  ,"52522  >  3478 [PSH, ACK] Seq=56060 Ack=493 Win=65535 Len=1036 [TCP segment of a reassembled PDU]"
"1086" ,"02:24:04.103466","10.140.212.198","10.224.168.94" ,"TCP"     ,"322"   ,"52522  >  3478 [PSH, ACK] Seq=57096 Ack=493 Win=65535 Len=268 [TCP segment of a reassembled PDU]"
"1087" ,"02:24:04.104901","10.224.168.94" ,"10.140.212.198","TCP"     ,"54"    ,"3478  >  52522 [ACK] Seq=493 Ack=54659 Win=65134 Len=0"
"1088" ,"02:24:04.105067","10.224.168.94" ,"10.140.212.198","TCP"     ,"819"   ,"3478  >  52519 [PSH, ACK] Seq=53952 Ack=305 Win=29200 Len=765 [TCP segment of a reassembled PDU]"
"1089" ,"02:24:04.105135","10.140.212.198","10.224.168.94" ,"TCP"     ,"54"    ,"52519  >  3478 [ACK] Seq=305 Ack=54717 Win=65535 Len=0"
"1090" ,"02:24:04.105320","10.224.168.94" ,"10.140.212.198","TCP"     ,"54"    ,"3478  >  52522 [ACK] Seq=493 Ack=56060 Win=65134 Len=0"
"1091" ,"02:24:04.105323","10.224.168.94" ,"10.140.212.198","TCP"     ,"54"    ,"3478  >  52522 [ACK] Seq=493 Ack=57364 Win=65134 Len=0"
"1092" ,"02:24:04.105961","10.224.168.94" ,"10.140.212.198","TCP"     ,"1514"  ,"3478  >  52519 [ACK] Seq=54717 Ack=305 Win=29200 Len=1460 [TCP segment of a reassembled PDU]"
"1093" ,"02:24:04.106343","10.224.168.94" ,"10.140.212.198","TCP"     ,"1299"  ,"3478  >  52519 [PSH, ACK] Seq=56177 Ack=305 Win=29200 Len=1245 [TCP segment of a reassembled PDU]"
"1094" ,"02:24:04.106415","10.140.212.198","10.224.168.94" ,"TCP"     ,"54"    ,"52519  >  3478 [ACK] Seq=305 Ack=57422 Win=65535 Len=0"
